{
  "schema_version": "1",
  "source": "E:\\royalstraightflesh\\videos\\2026-02-09 23-12-24.mkv",
  "source_duration": 3426.505,
  "source_duration_display": "57:06",
  "source_fps": 60.0,
  "detected_at": "2026-05-18T06:41:29Z",
  "detection_started_at": "2026-05-18T06:41:29Z",
  "detection_completed_at": "2026-05-18T06:44:47Z",
  "detection_params": {
    "sample_interval": 1.0,
    "blackout_threshold": 15.0,
    "min_match_duration": 300.0,
    "min_blackout_duration": 3.0,
    "no_audio": false,
    "use_gpu": null,
    "workers": null
  },
  "system_info": {
    "gpu_vendors_available": [
      "nvidia",
      "amd"
    ],
    "gpu_vendor_used": "nvidia",
    "vendor_preference": [
      "nvidia",
      "amd",
      "intel"
    ]
  },
  "matches": [
    {
      "index": 1,
      "start_time": 40.25,
      "end_time": 1076.125,
      "start_display": "00:40",
      "end_display": "17:56",
      "duration": 1035.875,
      "duration_display": "17m15s",
      "type": "fl_match",
      "output_file": "match_001.mp4"
    },
    {
      "index": 2,
      "start_time": 1252.25,
      "end_time": 2324.5,
      "start_display": "20:52",
      "end_display": "38:44",
      "duration": 1072.25,
      "duration_display": "17m52s",
      "type": "fl_match",
      "output_file": "match_002.mp4"
    },
    {
      "index": 3,
      "start_time": 2504.0,
      "end_time": 3370.75,
      "start_display": "41:44",
      "end_display": "56:10",
      "duration": 866.75,
      "duration_display": "14m26s",
      "type": "fl_match",
      "output_file": "match_003.mp4"
    }
  ],
  "gaps": [],
  "warnings": [],
  "brightness_samples": {
    "interval_s": 6.0,
    "values": [
      110.749,
      102.418,
      100.758,
      100.741,
      111.94,
      112.004,
      2.762,
      2.774,
      113.923,
      115.619,
      112.305,
      114.709,
      115.144,
      115.517,
      115.95,
      112.295,
      116.283,
      108.194,
      112.119,
      104.57,
      118.49,
      108.439,
      118.052,
      110.848,
      113.887,
      114.192,
      106.945,
      112.813,
      114.818,
      107.321,
      108.343,
      89.83,
      95.299,
      112.835,
      125.793,
      96.637,
      90.13,
      113.598,
      125.169,
      117.515,
      114.448,
      108.235,
      131.487,
      121.775,
      109.395,
      126.679,
      130.283,
      113.225,
      114.796,
      132.083,
      114.986,
      99.697,
      111.452,
      102.599,
      105.438,
      114.11,
      105.79,
      111.547,
      110.661,
      113.888,
      112.263,
      121.723,
      95.381,
      118.818,
      113.694,
      115.049,
      125.881,
      115.297,
      107.247,
      113.798,
      118.916,
      112.638,
      119.724,
      112.597,
      112.05,
      115.17,
      107.933,
      109.059,
      108.857,
      111.426,
      115.793,
      113.15,
      95.166,
      104.898,
      115.175,
      111.374,
      112.875,
      109.984,
      113.967,
      122.066,
      124.798,
      110.225,
      107.822,
      89.394,
      112.272,
      109.899,
      112.761,
      119.49,
      114.686,
      128.901,
      122.297,
      131.076,
      132.912,
      103.808,
      120.705,
      96.293,
      106.558,
      139.532,
      99.413,
      118.776,
      113.127,
      118.331,
      122.282,
      111.285,
      125.737,
      99.257,
      138.235,
      114.623,
      112.93,
      104.337,
      109.075,
      100.789,
      114.956,
      72.664,
      119.424,
      104.296,
      111.992,
      99.816,
      83.511,
      105.368,
      109.144,
      108.637,
      116.654,
      86.766,
      111.242,
      93.745,
      80.704,
      82.255,
      86.653,
      97.593,
      79.396,
      86.292,
      98.564,
      78.063,
      94.381,
      86.918,
      90.829,
      96.268,
      75.274,
      78.979,
      92.053,
      75.202,
      94.212,
      72.736,
      74.208,
      78.11,
      76.622,
      77.005,
      94.889,
      92.542,
      87.827,
      80.171,
      82.779,
      87.412,
      73.554,
      72.567,
      69.924,
      67.924,
      81.468,
      84.026,
      70.653,
      85.317,
      91.211,
      89.841,
      97.642,
      80.554,
      91.808,
      90.453,
      89.049,
      2.194,
      84.127,
      83.697,
      83.991,
      89.687,
      90.375,
      82.29,
      82.797,
      86.381,
      75.68,
      85.427,
      80.696,
      82.034,
      82.687,
      81.931,
      82.688,
      88.737,
      83.588,
      82.943,
      77.277,
      78.347,
      71.519,
      63.936,
      71.829,
      67.736,
      67.568,
      65.774,
      64.836,
      64.734,
      2.219,
      9.843,
      69.766,
      71.497,
      69.733,
      69.108,
      71.257,
      70.861,
      68.781,
      68.863,
      65.711,
      59.444,
      57.09,
      58.515,
      75.343,
      71.418,
      79.328,
      69.813,
      60.59,
      60.954,
      74.691,
      75.949,
      77.625,
      68.936,
      87.555,
      58.683,
      55.619,
      54.018,
      66.318,
      65.235,
      69.726,
      47.769,
      64.345,
      65.848,
      55.405,
      53.528,
      56.143,
      56.052,
      58.505,
      54.75,
      58.938,
      64.229,
      63.675,
      61.86,
      59.683,
      55.759,
      68.876,
      58.411,
      80.732,
      74.082,
      76.64,
      75.694,
      75.711,
      64.572,
      88.483,
      60.302,
      67.232,
      78.485,
      70.302,
      59.386,
      69.618,
      60.737,
      70.138,
      54.347,
      69.057,
      67.562,
      70.323,
      69.083,
      54.776,
      77.764,
      66.954,
      67.959,
      109.467,
      73.463,
      54.041,
      64.905,
      95.758,
      64.95,
      64.396,
      66.355,
      54.876,
      60.886,
      62.58,
      65.826,
      68.649,
      55.913,
      55.743,
      82.851,
      64.644,
      69.64,
      56.226,
      61.802,
      74.855,
      68.079,
      66.294,
      59.612,
      55.288,
      60.97,
      104.006,
      87.549,
      73.729,
      52.131,
      62.896,
      59.473,
      69.081,
      72.009,
      67.762,
      70.889,
      67.288,
      64.521,
      60.68,
      73.57,
      78.523,
      83.107,
      63.366,
      65.309,
      67.893,
      69.198,
      52.384,
      59.452,
      65.922,
      119.915,
      71.887,
      76.618,
      73.243,
      73.924,
      65.488,
      60.042,
      62.892,
      80.822,
      59.872,
      73.062,
      72.601,
      72.584,
      58.958,
      57.215,
      86.36,
      63.919,
      62.398,
      62.58,
      67.146,
      58.106,
      73.514,
      72.863,
      64.875,
      69.012,
      64.901,
      74.855,
      62.864,
      66.656,
      62.869,
      54.752,
      59.517,
      67.826,
      78.647,
      68.101,
      61.228,
      69.504,
      89.235,
      76.064,
      69.287,
      60.464,
      61.8,
      55.816,
      56.629,
      62.127,
      60.269,
      70.568,
      63.284,
      52.322,
      54.509,
      61.195,
      57.202,
      57.777,
      74.817,
      68.976,
      58.128,
      80.204,
      78.542,
      48.82,
      51.875,
      52.052,
      51.953,
      52.099,
      51.888,
      52.055,
      52.01,
      49.951,
      49.93,
      49.938,
      49.878,
      49.97,
      57.798,
      52.986,
      52.754,
      59.862,
      59.846,
      52.654,
      62.671,
      60.016,
      58.899,
      55.515,
      69.738,
      60.834,
      51.709,
      57.629,
      53.837,
      48.949,
      48.668,
      1.756,
      106.115,
      107.611,
      105.499,
      109.16,
      104.98,
      106.076,
      99.267,
      99.058,
      99.154,
      107.255,
      104.699,
      105.765,
      101.473,
      89.409,
      102.032,
      105.463,
      106.172,
      102.617,
      102.746,
      95.622,
      1.737,
      108.721,
      104.02,
      106.323,
      106.229,
      101.012,
      102.566,
      110.277,
      108.423,
      112.328,
      124.442,
      110.476,
      118.934,
      106.868,
      98.44,
      101.855,
      105.549,
      95.394,
      110.815,
      93.39,
      93.046,
      104.299,
      97.63,
      84.364,
      86.297,
      93.578,
      82.45,
      73.569,
      80.944,
      82.128,
      71.104,
      73.361,
      65.147,
      57.795,
      82.348,
      88.066,
      86.154,
      72.636,
      83.976,
      67.87,
      84.533,
      82.978,
      79.255,
      86.18,
      87.682,
      92.78,
      76.364,
      94.671,
      89.114,
      89.013,
      70.421,
      63.108,
      71.133,
      94.548,
      60.615,
      82.408,
      77.601,
      92.135,
      78.94,
      90.329,
      101.635,
      89.036,
      106.918,
      90.036,
      91.553,
      87.693,
      99.762,
      96.659,
      80.055,
      109.013,
      105.793,
      105.251,
      135.28,
      114.865,
      109.004,
      118.429,
      106.457,
      114.058,
      116.024,
      120.168,
      107.837,
      108.023,
      105.422,
      104.739,
      102.144,
      93.744,
      106.78,
      99.685,
      101.722,
      98.515,
      103.817,
      119.118,
      69.318,
      97.347,
      84.831,
      91.547,
      94.029,
      93.67,
      79.499,
      78.358,
      70.94,
      71.172,
      76.822,
      76.093,
      82.939,
      87.904,
      77.315,
      74.111,
      79.412,
      69.099,
      69.874,
      72.841,
      70.3,
      67.266,
      95.884,
      79.794,
      79.856,
      69.492,
      99.236,
      106.429,
      63.815,
      59.794,
      67.018,
      64.489,
      90.994,
      82.701,
      83.084,
      83.325,
      83.564,
      83.874,
      84.195,
      84.671,
      84.877
    ]
  }
}